Category,Questions,Answer
General,   What is the capital of Malaysia?,The capital of Malaysia is Kuala Lumpur.
,What is the official language of Malaysia?,The official language of Malaysia is Bahasa Malaysia (Malay).
,What is the currency of Malaysia?,The currency of Malaysia is Malaysian Ringgit (MYR).
,What are some public holidays coming up in Malaysia?,"Public holidays vary each year, but common holidays include Hari Raya Aidilfitri, Chinese New Year, Deepavali, and Merdeka Day."
,What is the visa policy for Malaysia?,"The visa policy for Malaysia depends on your nationality. Some countries have visa-free access, while others require a visa."
,Is Malaysia safe to visit?,"Yes, generally Malaysia is safe for tourists. However, it's always wise to be aware of your surroundings and take precautions."
,What are the best things to do in Malaysia?,"The best things to do in Malaysia include exploring rainforests, visiting historical sites, relaxing on beaches, and experiencing the vibrant culture."
,What is the weather like in Malaysia?,The weather in Malaysia is hot and humid year-round.
,What is the population of Malaysia?,"As of 2021, the population of Malaysia is approximately 32 million."
,What is the time zone of Malaysia?,"Malaysia is in the Malaysia Time Zone (MYT), which is 8 hours ahead of GMT."
Culture,What are the major ethnic groups in Malaysia?,"The major ethnic groups in Malaysia are Malay, Chinese, Indian, and Indigenous groups."
,What are some interesting Malaysian cultural facts?,"Malaysia is known for its cultural diversity, traditional arts, and festivals."
,What are some popular Malaysian festivals?,"Popular Malaysian festivals include Eid al-Fitr, Chinese New Year, Deepavali (Festival of Lights), and Thaipusam."
,What is the food like in Malaysia?,"Malaysian cuisine is a delicious blend of Malay, Chinese, and Indian influences. Popular dishes include Nasi Lemak, Satay, Rendang, and Roti Canai."
,What are some traditional Malaysian drinks?,"Traditional Malaysian drinks include Teh tarik (pulled milk tea), Kopi (coffee), Air bandung (rose milk), and Teh ais (iced tea)."
,What are some traditional Malaysian dances?,"Traditional Malaysian dances include the Joget, Zapin, and Silat."
,What are the key cultural values in Malaysia?,"Key cultural values in Malaysia include respect for elders, strong family ties, and community harmony."
,What is the national costume of Malaysia?,The traditional attire for Malays is the Baju Melayu for men and Baju Kurung for women.
,How do Malaysians celebrate weddings?,"Malaysian weddings are often elaborate, with traditional attire, music, and multiple ceremonies."
,What are some famous Malaysian landmarks?,"Famous Malaysian landmarks include the Petronas Twin Towers, Batu Caves, and Penang Hill."
Language,How difficult is it to learn basic Bahasa Malaysia phrases?,Basic Malay phrases are relatively easy to learn for most travelers.
,Are there any regional dialects in Malaysia?,"Yes, there are several regional dialects spoken throughout the country."
,What are some useful Malay phrases for tourists?,"Useful Malay phrases for tourists include ""Selamat datang"" (Welcome), ""Terima kasih"" (Thank you), ""Berapa harga?"" (How much?), ""Di mana tandas?"" (Where is the toilet?)."
,Is English widely spoken in Malaysia?,"Yes, English is widely spoken, especially in urban areas and tourist spots."
,What language is used in Malaysian schools?,"The primary language of instruction in Malaysian schools is Bahasa Malaysia, but English is also taught."
,What are some common Malay greetings?,"Common Malay greetings include ""Apa khabar?"" (How are you?), ""Selamat pagi"" (Good morning), ""Selamat malam"" (Good night)."
,What are some Malay words related to food?,"Malay words related to food include ""Makanan"" (food), ""Minuman"" (drinks), ""Lapar"" (hungry), ""Sedap"" (delicious)."
,How do you say 'thank you' in Malay?,"""Thank you"" in Malay is ""Terima kasih."""
,What is the Malay word for 'beautiful'?,"The Malay word for ""beautiful"" is ""Cantik."""
,How do you ask for directions in Malay?,"To ask for directions in Malay, you say ""Boleh tolong tunjukkan arah?"" (Can you show me the direction?)."
Accommodation,What are the different types of accommodation available in Malaysia?,"Accommodation options in Malaysia range from budget hostels to luxury hotels, homestays, and boutique hotels."
,Where are some unique places to stay in Malaysia?,"Unique places to stay in Malaysia include traditional Malay houses, treehouses in the rainforest, and luxury beach resorts."
,Are there any eco-friendly accommodations in Malaysia?,"Yes, there are several eco-resorts and lodges that focus on sustainable practices in Malaysia."
,What is the average cost of a hotel in Malaysia?,"The average cost of a hotel in Malaysia varies by location and quality, ranging from budget hotels at $20 per night to luxury hotels at $200+ per night."
, Can I book accommodation online in Malaysia?,"Yes, many hotels and guesthouses in Malaysia can be booked online through various travel websites."
,What is a homestay in Malaysia?,A homestay in Malaysia involves staying with a local family and experiencing their way of life.
,Are there any backpacker hostels in Malaysia?,"Yes, popular backpacker areas like Kuala Lumpur, Penang, and Langkawi have many hostels."
,What is the check-in and check-out time in Malaysian hotels?,"Typically, check-in is around 2 PM and check-out is around 12 PM in Malaysian hotels."
,Do hotels in Malaysia offer airport transfers?,"Many hotels in Malaysia offer airport transfers, either for free or for a fee."
,Are there any pet-friendly accommodations in Malaysia?,"Yes, some hotels and resorts in Malaysia are pet-friendly."
Travel,What is the best time to visit Malaysia?,"Generally, December to February offers the best weather for visiting Malaysia."
,How do I get around Malaysia?,"Options for getting around Malaysia include flights, trains, buses, taxis, ride-sharing apps, and ferries."
,Do I need travel insurance for Malaysia?,It's highly recommended to have travel insurance for Malaysia.
,What are some things to pack for a trip to Malaysia?,"Pack light, breathable clothing, comfortable shoes, sunscreen, a hat, and insect repellent."
,Can I rent a car in Malaysia?,"Yes, car rentals are available in major cities and airports."
,What are some popular tourist destinations in Malaysia?,"Popular tourist destinations in Malaysia include Kuala Lumpur, Penang, Langkawi, and Borneo."
,Are there any travel restrictions in Malaysia due to COVID-19?,Travel restrictions due to COVID-19 can vary; it's important to check the latest information before traveling.
,What is the best way to travel between Malaysian states?,"The best way to travel between Malaysian states is by domestic flights, long-distance buses, or trains."
,Are there any health precautions I should take before traveling to Malaysia?,"Health precautions include vaccinations for hepatitis A and B, typhoid, and being cautious about food and water hygiene."
,Is Malaysia a good destination for solo travelers?,"Yes, Malaysia is a good destination for solo travelers with its friendly locals and well-established tourist infrastructure."
Activities,What are some hidden gems or lesser-known destinations in Malaysia?,"Hidden gems in Malaysia include the Cameron Highlands, the Perhentian Islands, and the state of Terengganu."
,Can I go hiking in Malaysia?,"Yes, there are many great hiking trails throughout the country, from easy to challenging."
,Are there any beaches in Malaysia?,"Yes, Malaysia has many beautiful beaches, particularly on the islands."
,Can I see wildlife in Malaysia?,"Yes, Malaysia is home to a diverse range of wildlife, including orangutans, elephants, hornbills, and turtles."
,What are some popular water activities in Malaysia?,"Popular water activities in Malaysia include snorkeling, scuba diving, and island hopping."
,Are there any cultural activities to participate in Malaysia?,"Cultural activities to participate in Malaysia include traditional dance performances, batik workshops, and cooking classes."
,Can I go cycling in Malaysia?,"Yes, cycling is popular in Malaysia, with routes in places like Penang and the Cameron Highlands."
,Are there any adventure sports in Malaysia?,"Adventure sports in Malaysia include rock climbing, white-water rafting, and zip-lining."
,What are some kid-friendly activities in Malaysia?,"Kid-friendly activities in Malaysia include visiting theme parks, aquariums, and zoos."
,Are there any UNESCO World Heritage Sites in Malaysia?,"Malaysia has four UNESCO World Heritage Sites: George Town, Melaka, Gunung Mulu National Park, and Kinabalu Park."
Money,Do I need to tip in Malaysia?,"Tipping is not customary in Malaysia, but it's appreciated if you want to show your appreciation for good service."
,Can I use credit cards in Malaysia?,"Yes, credit cards are widely accepted in cities and tourist areas."
,Where can I exchange currency in Malaysia?,"Currency can be exchanged at banks, exchange bureaus, and airports."
,Are ATMs available in Malaysia?,"Yes, ATMs are widely available in cities and towns."
,What is the cost of living like in Malaysia?,The cost of living in Malaysia is relatively low compared to Western countries.
,Can I use my home country bank card in Malaysia?,"Yes, most international bank cards can be used at ATMs, but check with your bank for any fees."
,What is the tipping etiquette in restaurants?,"Tipping is not mandatory, but you can leave a small amount for good service. Some restaurants include a service charge."
,Is it common to bargain in Malaysia?,"Bargaining is common in markets and small shops, but not in large stores or restaurants."
,How much cash should I carry while traveling in Malaysia?,"It's good to carry some cash for small purchases, but credit cards are widely accepted."
,Are there any taxes on goods and services in Malaysia?,"Yes, Malaysia has a Sales and Services Tax (SST)."
Shopping,What are some must-visit night markets in Malaysia?,"Must-visit night markets include Petaling Street in Kuala Lumpur, Jonker Street in Melaka, and Gaya Street in Kota Kinabalu."
,Are there any local brands or designers I should look out for?,"Look out for local brands like Bonia, Padini, and Royal Selangor."
,What are some popular shopping malls in Malaysia?,"Popular shopping malls include Pavilion KL, Suria KLCC, and Mid Valley Megamall in Kuala Lumpur."
,Can I buy electronics in Malaysia?,"Yes, Malaysia is known for its electronics markets, especially in Low Yat Plaza in Kuala Lumpur."
,What are some traditional Malaysian crafts to buy?,"Traditional Malaysian crafts to buy include batik, songket, pewter items, and traditional wood carvings."
,Are there any famous shopping streets in Malaysia?,Bukit Bintang in Kuala Lumpur is a popular shopping district.
,What are the opening hours for shops in Malaysia?,"Most shops open from 10 AM to 10 PM, but this can vary."
,Can I find international brands in Malaysia?,"Yes, international brands are widely available in major shopping malls."
,What is the duty-free shopping like in Malaysia?,Langkawi and Labuan are popular duty-free shopping destinations.
,Are there any unique souvenirs to buy in Malaysia?,"Unique souvenirs to buy in Malaysia include traditional kites (wau), Malaysian spices, and local snacks."
Food & Drink,What are some regional Malaysian specialties to try?,"Regional Malaysian specialties to try include Penang Laksa, Sarawak Laksa, and Ipoh Hor Fun."
,What is the national dish of Malaysia?,The national dish of Malaysia is Nasi Lemak.
,What are some popular street foods in Malaysia?,"Popular street foods in Malaysia include Char Kway Teow, Rojak, and Satay."
,Are there any food festivals in Malaysia?,The Penang International Food Festival is a popular food festival.
,What are some vegetarian dishes in Malaysian cuisine?,"Vegetarian dishes in Malaysian cuisine include Nasi lemak with vegetarian sides, Roti Canai with dhal, and Chinese stir-fried vegetables."
,Is tap water safe to drink in Malaysia?,It's recommended to drink bottled or filtered water.
,What are some traditional Malaysian desserts?,"Traditional Malaysian desserts include Cendol, Ais Kacang, and Kuih."
,Are there any unique beverages in Malaysia?,Unique beverages in Malaysia include Teh tarik (pulled tea) and Milo dinosaur (a chocolate malt drink with extra Milo powder).
,Can I find international cuisine in Malaysia?,"Yes, there are many international restaurants, especially in larger cities."
,What are some popular dining etiquette tips in Malaysia?,"Use your right hand for eating if using hands, and it's polite to try a bit of everything offered."
"Facts, Records, Guinness World Records",What is Malaysia known for internationally?,"Malaysia is known for its diverse culture, cuisine, and natural beauty."
,Does Malaysia hold any Guinness World Records?,"Yes, Malaysia has several records, including the largest serving of satay."
,What is the tallest building in Malaysia?,The tallest building in Malaysia is the Merdeka 118.
,What is the largest cave chamber in Malaysia?,The largest cave chamber in Malaysia is Sarawak Chamber in Gunung Mulu National Park.
,What is the oldest rainforest in Malaysia?,"The oldest rainforest in Malaysia is the Taman Negara rainforest, estimated to be 130 million years old."
,What is the longest bridge in Malaysia?,"The longest bridge in Malaysia is the Sultan Abdul Halim Muadzam Shah Bridge, also known as Penang Second Bridge."
,What is the largest flower found in Malaysia?,"The largest flower found in Malaysia is the Rafflesia, which can grow up to 1 meter in diameter."
,What is the highest peak in Malaysia?,"The highest peak in Malaysia is Mount Kinabalu in Sabah, at 4,095 meters."
,What is Malaysia’s most visited tourist attraction?,Malaysia’s most visited tourist attraction is the Petronas Twin Towers in Kuala Lumpur.
,What is the largest shopping mall in Malaysia?,"The largest shopping mall in Malaysia is 1 Utama in Petaling Jaya, which is one of the largest malls in the world."
,,
,,
